<?xml version="1.0" encoding="UTF-8"?>
<jrouter xmlns:xsi="http://www.w3.org/2001/XMLSchema-instance"
         xsi:noNamespaceSchemaLocation="../../main/resources/jrouter-1.6.xsd">

    <action-factory class="jrouter.impl.PathActionFactory">
        <property name="defaultInterceptorStack" value="empty"/>
        <property name="defaultResultType" value="empty"/>
        <property name="pathSeparator" value="/"/>
        <property name="extension" value="."/>
        <property name="actionCacheNumber" value="100000"/>
        <property name="converterFactory" value="jrouter.impl.MultiParameterConverterFactory"/>
        <property name="notExist" value="-1-1-1"/>
    </action-factory>

    <!-- interceptor -->
    <interceptor class="jrouter.interceptor.SampleInterceptor"/>

    <!-- interceptor-stack -->
    <interceptor-stack class="jrouter.interceptor.DefaultInterceptorStack"/>

    <!-- result-type -->
    <result-type class="jrouter.result.DefaultResult"/>

    <!-- result -->
    <result class="jrouter.result.DefaultResult"/>

    <!-- demo interceptor-stack -->
    <interceptor-stack class="jrouter.interceptor.DemoInterceptor"/>

    <!-- demo intercepror -->
    <interceptor class="jrouter.interceptor.DemoInterceptor">
        <property name="value" value="demo interceptor"/>
        <property name="number" value="10000"/>
        <property name="null" value="not supported"/>
    </interceptor>

    <!-- demo result-type -->
    <result-type class="jrouter.result.DemoResult">
        <property name="value" value="demo result"/>
        <property name="null" value="not supported"/>
    </result-type>

    <!-- demo result -->
    <result class="jrouter.result.DemoResult"/>

    <!-- demo action -->
    <action class="jrouter.SimpleAction">
        <property name="string" value="admin"/>
        <property name="number" value="300"/>
        <property name="number" value="200"/>
        <property name="number" value="100"/>
        <property name="null" value="not supported"/>

        <path name="/test/inject2">
            <property name="number" value="200"/>
            <property name="null_path_value" value="-1-1-1"/>
        </path>
    </action>
</jrouter>